<?xml version="1.0" encoding="UTF-8"?><!DOCTYPE ParametricBiCubicPatch SYSTEM "../../etc/xml/vsdk.dtd">
<ParametricBiCubicPatch approximationSteps="12" type="7"><ParametricCubicCurve approximationSteps="50"><Point type="3"><Vector3D>0.0 0.0 0.0</Vector3D><Vector3D>0.5 0.0 0.0</Vector3D><Vector3D>0.0 0.0 0.5</Vector3D></Point><Point type="3"><Vector3D>0.5 0.0 1.0</Vector3D><Vector3D>0.0 0.0 1.0</Vector3D><Vector3D>1.0 0.0 1.0</Vector3D></Point><Point type="3"><Vector3D>0.5 1.0 1.0</Vector3D><Vector3D>1.0 1.0 1.0</Vector3D><Vector3D>0.0 1.0 1.0</Vector3D></Point><Point type="3"><Vector3D>0.0 1.0 0.0</Vector3D><Vector3D>0.0 1.0 0.5</Vector3D><Vector3D>0.5 1.0 0.0</Vector3D></Point><Point type="3"><Vector3D>0.0 0.0 0.0</Vector3D><Vector3D>0.5 0.0 0.0</Vector3D><Vector3D>0.0 0.0 0.5</Vector3D></Point></ParametricCubicCurve></ParametricBiCubicPatch>