<?xml version="1.0" encoding="UTF-8"?><!DOCTYPE ParametricCubicCurve SYSTEM "../../etc/xml/vsdk.dtd">
<ParametricCubicCurve approximationSteps="50"><Point type="3"><Vector3D>0.0 0.0 0.0</Vector3D><Vector3D>0.0 0.0 0.0</Vector3D><Vector3D>0.0 1.0 0.0</Vector3D></Point><Point type="3"><Vector3D>1.0 1.0 0.0</Vector3D><Vector3D>0.0 1.0 0.0</Vector3D><Vector3D>2.0 1.0 0.0</Vector3D></Point><Point type="3"><Vector3D>2.0 0.0 1.0</Vector3D><Vector3D>1.5 -0.5 0.0</Vector3D><Vector3D>0.0 0.0 0.0</Vector3D></Point></ParametricCubicCurve>